{
  "cpsDefendant": [
    {
      "matchingId": "4b64afd7-686f-4ac8-96f6-ca948d83af3f",
      "cpsDefendantId" : "CPS_DEFENDANT_ID",
      "forename" : "%s",
      "surname": "%s",
      "dateOfBirth": "%s",
      "principalCharges": "principal-charges",
      "localAuthorityDetailsForYouthDefendants": {
        "address1": "address1",
        "authority": "test",
        "email": "test@test.com",
        "forename": "forename",
        "isLookedAfterChild": true,
        "phone": "1234567890",
        "postcode": "G5 0TN",
        "reference": "test",
        "surname": "surname",
        "title": "Mr"
      },
      "parentGuardianForYouthDefendants": {
        "address1": "address1",
        "address2": "address2",
        "email": "test@test.com",
        "forename": "parentForename",
        "phone": "1234567890",
        "postcode": "G5 0TN",
        "relationshipToDefendant": "test",
        "surname": "weterw",
        "title": "Mr"
      }
    }
  ],
  "submissionId": "e85d2c62-af1f-4674-863a-0891e67e325b",
  "submissionStatus": "PENDING",
  "prosecutionCaseSubject": {
    "prosecutingAuthority": "The OU Code of the prosecuting authority",
    "urn": "%s"
  },
  "tag": "tag",
  "ptphAdvocate": {
    "email": "test@test.com",
    "name": "name",
    "phone": "7778888345"
  },
  "trialAdvocate": {
    "email": "test@test.com",
    "name": "name",
    "phone": "7778888345"
  },
  "reviewingLawyer": {
    "email": "test@test.com",
    "name": "name",
    "phone": "7778888345"
  },
  "prosecutionCaseProgressionOfficer": {
    "email": "test@test.com",
    "name": "name",
    "phone": "7778888345"
  },
  "officerInTheCase": {
    "email": "test@test.com",
    "name": "name",
    "phone": "7778888345"
  },
  "cpsOffice": "Cps Office",
  "draftIndictment": "Y",
  "summaryOfCircumstances": "Y",
  "statementsForPAndICm": "Y",
  "exhibitsForPAndICm": "Y",
  "cctv": "Y",
  "cctvNotes": "Cctv Notes",
  "streamlinedForensicReport": "Y",
  "medicalEvidence": "Y",
  "expertEvidence": "Y",
  "badCharacter": "Y",
  "hearsay": "Y",
  "specialMeasures": "Y",
  "criminalRecord": "Y",
  "victimPersonalStatement": "Y",
  "disclosureManagementDoc": "Y",
  "thirdParty": "Y",
  "reviewDisclosableMaterial": "Y",
  "witnesses": [
    {
      "firstNameOfIntermediaryKnownAtPtph": "first name",
      "lastNameOfIntermediaryKnownAtPtph": "last name",
      "policeOfficerSubject": {
        "officerInCharge": true,
        "officeCollarNumber": "collar number",
        "officerRank": "Rank1"
      },
      "relevantDisputedIssue": "Issue 1",
      "witnessFirstName": "forename",
      "witnessLastName": "abc"
    }
  ]
}
